,RPT,Company,Date,Time,Type,Title,Speacker,Provenance,Role,Is Q&A,Is Presentation,Is Transcript,Content
31,18608632,AUGME TECHNOLOGIES INC,01/09/2012,4:00PM,AUGT.OB,Q3 2012 Augme Technologies Inc Earnings Conference Call,Art Asad,Argasell USA,Analyst,True,False,False,"Yes, this question backs up a little on that last person's question on the Yahoo! countersuit. That was the first time I had heard that and I was justwondering, from Augme's perspective, is there any merit in that Yahoo! countersuit against Augme?"
32,18608632,AUGME TECHNOLOGIES INC,01/09/2012,4:00PM,AUGT.OB,Q3 2012 Augme Technologies Inc Earnings Conference Call,Paul Arena,"Augme Technologies, Inc.","Chairman, CEO",True,False,False,"No, we don't believe so, Art. This is Paul. I've looked at it very carefully, and in fact, we believe that we have claims that predate Yahoo's claims insufficient grounds that would negate those claims altogether. We'll see how it shakes out eventually, but, we feel very confident that those are notgoing to be a problem for us."
33,18608632,AUGME TECHNOLOGIES INC,01/09/2012,4:00PM,AUGT.OB,Q3 2012 Augme Technologies Inc Earnings Conference Call,Art Asad,Argasell USA,Analyst,True,False,False,"When I read that, Paul, it came to me as kind of a childish play that all of a sudden Yahoo! is getting the realization that we are -- we've set a courtdate and it's coming to a realization that we are going to strengthen our position on the patents with them. But (multiple speakers)"
34,18608632,AUGME TECHNOLOGIES INC,01/09/2012,4:00PM,AUGT.OB,Q3 2012 Augme Technologies Inc Earnings Conference Call,Paul Arena,"Augme Technologies, Inc.","Chairman, CEO",True,False,False,"That's exactly right, Art. In fact, we look at it at the same way is that they are going to strengthen our position, so, we welcomed it."
35,18608632,AUGME TECHNOLOGIES INC,01/09/2012,4:00PM,AUGT.OB,Q3 2012 Augme Technologies Inc Earnings Conference Call,Art Asad,Argasell USA,Analyst,True,False,False,"Okay. Okay, well that's all I wanted. Keep doing a great job, Paul.You're running the company very well, and I'm personally very pleased to see that.And Jason and I have talked about it, we're really proud that you're at the helm of the company."
36,18608632,AUGME TECHNOLOGIES INC,01/09/2012,4:00PM,AUGT.OB,Q3 2012 Augme Technologies Inc Earnings Conference Call,Paul Arena,"Augme Technologies, Inc.","Chairman, CEO",True,False,False,"I appreciate it, Art. And thank you for all your patience and support and confidence. We've made a lot of progress and we are going to continue tomake progress, and we're very excited about the prospects of the business going forward. If there's no further questions at this time, I'm going to go on ahead and conclude the call. Thank you for everyone for joining us. And we lookforward to future success together. Thank you."
37,18608632,AUGME TECHNOLOGIES INC,01/09/2012,4:00PM,AUGT.OB,Q3 2012 Augme Technologies Inc Earnings Conference Call,Operator,NA,NA,True,False,False,"Ladies and gentlemen, that concludes your conference call for today. We thank you for your participation and ask that you please disconnect yourline."
